category,@id,name,description,supersededBy,nameZh,descriptionZh,alternateName,wikidataName,wikidataUrl,wikipediaUrl,schemaorgUrl
property,http://cnschema.org/hasPart,hasPart,Indicates a CreativeWork that is (in some sense) a part of this CreativeWork.,,作品组件,表示某个作品是该作品的一部分,,,,,http://schema.org/hasPart
property,http://cnschema.org/headline,headline,Headline of the article.,,文章标题,文章标题,,,,https://en.wikipedia.org/wiki/Headline,http://schema.org/headline
property,http://cnschema.org/height,height,The height of the item.,,高度,高度,,,,https://en.wikipedia.org/wiki/Height,http://schema.org/height
property,http://cnschema.org/highPrice,highPrice,The highest price of all offers available.,,最高价,最高价格,,,,,http://schema.org/highPrice
property,http://cnschema.org/hiringOrganization,hiringOrganization,Organization offering the job position.,,招聘机构,提供工作职位的机构,,,,,http://schema.org/hiringOrganization
property,http://cnschema.org/homeLocation,homeLocation,A contact location for a person's residence.,,家庭地址,家庭联系地址,家庭住址,,,,http://schema.org/homeLocation
property,http://cnschema.org/homeTeam,homeTeam,The home team in a sports event.,,主队,体育运动中的主队,主场对,,,,http://schema.org/homeTeam
property,http://cnschema.org/honorificPrefix,honorificPrefix,An honorific prefix preceding a Person's name such as Dr/Mrs/Mr.,,姓名前面的敬语,放在姓名前面的敬语,,honorific prefix,http://www.wikidata.org/entity/P511,https://en.wikipedia.org/wiki/Honorific_prefixes,http://schema.org/honorificPrefix
property,http://cnschema.org/honorificSuffix,honorificSuffix,An honorific suffix preceding a Person's name such as M.D. /PhD/MSCSW.,,姓名后面的敬语,放在姓名后面的敬语,,honorific suffix,http://www.wikidata.org/entity/P1035,https://en.wikipedia.org/wiki/Honorific_suffix,http://schema.org/honorificSuffix
property,http://cnschema.org/hostingOrganization,hostingOrganization,"The organization (airline, travelers' club, etc.) the membership is made with.",,会员服务提供者,航空公司，旅游俱乐部等提供会员资格的组织,,,,,http://schema.org/hostingOrganization
property,http://cnschema.org/hoursAvailable,hoursAvailable,The hours during which this service or contact is available.,,服务时间,该服务或联系人可用的时间。,,,,,http://schema.org/hoursAvailable
property,http://cnschema.org/httpMethod,httpMethod,An HTTP method that specifies the appropriate HTTP method for a request to an HTTP EntryPoint. Values are capitalized strings as used in HTTP.,,http方法,例如GET，POST,,,,https://en.wikipedia.org/wiki/HTTP_method,http://schema.org/httpMethod
property,http://cnschema.org/iataCode,iataCode,IATA identifier for an airline or airport.,,国际航空运输协会代码,国际航空运输协会代码,,IATA airport code,https://www.wikidata.org/entity/P238,https://en.wikipedia.org/wiki/IATA_code,http://schema.org/iataCode
property,http://cnschema.org/icaoCode,icaoCode,ICAO identifier for an airport.,,国际民航组织机场代码,国际民航组织机场代码,,ICAO airport code,https://www.wikidata.org/entity/P239,https://en.wikipedia.org/wiki/International_Civil_Aviation_Organization_airport_code,http://schema.org/icaoCode
property,http://cnschema.org/identifier,identifier,"The identifier property represents any kind of identifier for any kind of Thing, such as ISBNs, GTIN codes, UUIDs etc. Schema.org provides dedicated properties for representing many of these, either as textual strings or as URL (URI) links. See background notes for more details.",,标识符,标识符,,,,https://en.wikipedia.org/wiki/Identifier,http://schema.org/identifier
property,http://cnschema.org/illustrator,illustrator,The illustrator of the book.,,插图绘制者,书籍的插图绘制者,插图,illustrator,http://www.wikidata.org/entity/P110,https://en.wikipedia.org/wiki/Illustrator,http://schema.org/illustrator
property,http://cnschema.org/image,image,An image of the item. This can be a URL or a fully described ImageObject.,,图片,图片,,image,https://www.wikidata.org/entity/P18,https://en.wikipedia.org/wiki/Image,http://schema.org/image
property,http://cnschema.org/inAlbum,inAlbum,The album to which this recording belongs.,,所属专辑,音乐所属的专辑,专辑,,,,http://schema.org/inAlbum
property,http://cnschema.org/inBroadcastLineup,inBroadcastLineup,The CableOrSatelliteService offering the channel.,,提供该频道的有线或者卫星服务,提供该频道的有线或者卫星服务,,,,,http://schema.org/inBroadcastLineup
property,http://cnschema.org/inLanguage,inLanguage,The language of the content or performance or used in an action. Please use one of the language codes from the IETF BCP 47 standard. See also availableLanguage.,,使用语言,使用的语言,,,,,http://schema.org/inLanguage
property,http://cnschema.org/inPlaylist,inPlaylist,The playlist to which this recording belongs.,,所属播放列表,音乐所属的播放列表,,,,,http://schema.org/inPlaylist
property,http://cnschema.org/incentiveCompensation,incentiveCompensation,Description of bonus and commission compensation aspects of the job.,,奖金补贴,奖金补贴,,,,,http://schema.org/incentiveCompensation
property,http://cnschema.org/incentives,incentives,Description of bonus and commission compensation aspects of the job.,http://schema.org/incentiveCompensation,奖金,奖金,,,,,http://schema.org/incentives
property,http://cnschema.org/includedComposition,includedComposition,Smaller compositions included in this work (e.g. a movement in a symphony).,,包含乐曲,包含乐曲,,,,,http://schema.org/includedComposition
property,http://cnschema.org/includedDataCatalog,includedDataCatalog,"A data catalog which contains this dataset (this property was previously 'catalog', preferred name is now 'includedInDataCatalog').",http://schema.org/includedInDataCatalog,所在数据集目录,所在的数据集目录,,,,,http://schema.org/includedDataCatalog
property,http://cnschema.org/includedInDataCatalog,includedInDataCatalog,A data catalog which contains this dataset.,,所在数据集目录,所在的数据集目录,,,,,http://schema.org/includedInDataCatalog
property,http://cnschema.org/includesObject,includesObject,This links to a node or nodes indicating the exact quantity of the products included in the offer.,,包含对象,包含的对象,,,,,http://schema.org/includesObject
property,http://cnschema.org/industry,industry,The industry associated with the job position.,,所属行业,职位关联的行业,所在行业,,,,http://schema.org/industry
property,http://cnschema.org/ineligibleRegion,ineligibleRegion,"The ISO 3166-1 (ISO 3166-1 alpha-2) or ISO 3166-2 code, the place, or the GeoShape for the geo-political region(s) for which the offer or delivery charge specification is not valid, e.g. a region where the transaction is not allowed. See also eligibleRegion.",,不适用地区,不适合区域,,,,,http://schema.org/ineligibleRegion
property,http://cnschema.org/ingredients,ingredients,"A single ingredient used in the recipe, e.g. sugar, flour or garlic.",http://schema.org/recipeIngredient,食材,菜谱中使用的食材,,,,,http://schema.org/ingredients
property,http://cnschema.org/installUrl,installUrl,"URL at which the app may be installed, if different from the URL of the item.",,APP安装地址,APP安装地址,,,,,http://schema.org/installUrl
property,http://cnschema.org/instructor,instructor,A person assigned to instruct or provide instructional assistance for the CourseInstance.,,教师,教授课程的人,授课者,,,,http://schema.org/instructor
property,http://cnschema.org/instrument,instrument,The object that helped the agent perform the action. e.g. John wrote a book with a pen.,,工具,工作时所需用的器具,,,,https://en.wikipedia.org/wiki/Instrument,http://schema.org/instrument
property,http://cnschema.org/interactionCount,interactionCount,"This property is deprecated, alongside the UserInteraction types on which it depended.",http://schema.org/interactionStatistic,交互总数,交互总数,,,,,http://schema.org/interactionCount
property,http://cnschema.org/interactionService,interactionService,The WebSite or SoftwareApplication where the interactions took place.,,交互对应的软件服务,交互对应的软件服务,,,,,http://schema.org/interactionService
property,http://cnschema.org/interactionStatistic,interactionStatistic,The number of interactions for the CreativeWork using the WebSite or SoftwareApplication. The most specific child type of InteractionCounter should be used.,,交互统计,交互统计,,,,,http://schema.org/interactionStatistic
property,http://cnschema.org/interactionType,interactionType,"The Action representing the type of interaction. For up votes, +1s, etc. use LikeAction. For down votes use DislikeAction. Otherwise, use the most specific Action.",,交互类型,交互类型,,,,,http://schema.org/interactionType
property,http://cnschema.org/interactivityType,interactivityType,"The predominant mode of learning supported by the learning resource. Acceptable values are 'active', 'expositive', or 'mixed'.",,交互类型,交互类型,,,,,http://schema.org/interactivityType
property,http://cnschema.org/interestRate,interestRate,"The interest rate, charged or paid, applicable to the financial product. Note: This is different from the calculated annualPercentageRate.",,利率,适用于金融产品的利率,,,,https://en.wikipedia.org/wiki/Interest_rate,http://schema.org/interestRate
property,http://cnschema.org/inventoryLevel,inventoryLevel,The current approximate inventory level for the item or items.,,库存量,当前产品的库存量,,,,,http://schema.org/inventoryLevel
property,http://cnschema.org/isAccessibleForFree,isAccessibleForFree,A flag to signal that the publication is accessible for free.,,是否免费,表示该出版物可免费获得的标志。,,,,,http://schema.org/isAccessibleForFree
property,http://cnschema.org/isAccessoryOrSparePartFor,isAccessoryOrSparePartFor,A pointer to another product (or multiple products) for which this product is an accessory or spare part.,,是另一产品的附件或备件,指明本产品是其他产品的附件或备件的指针。,,,,,http://schema.org/isAccessoryOrSparePartFor
property,http://cnschema.org/isBasedOn,isBasedOn,"A resource that was used in the creation of this resource. This term can be repeated for multiple sources. For example, http://example.com/great-multiplication-intro.html.",,上游资源URL,上游资源URL,,,,,http://schema.org/isBasedOn
property,http://cnschema.org/isBasedOnURL,isBasedOnURL,"A resource that was used in the creation of this resource. This term can be repeated for multiple sources. For example, http://example.com/great-multiplication-intro.html.",http://schema.org/isBasedOn,上游资源,上游资源,,,,,http://schema.org/isBasedOnUrl
property,http://cnschema.org/isConsumableFor,isConsumableFor,A pointer to another product (or multiple products) for which this product is a consumable.,,下游产品,指明此产品是消耗品的另一产品（或多个产品）的指针。,,,,,http://schema.org/isConsumableFor
property,http://cnschema.org/isFamilyFriendly,isFamilyFriendly,Indicates whether this content is family friendly.,,是否适合全家观看,指明是否适合全家观看,,,,,http://schema.org/isFamilyFriendly
property,http://cnschema.org/isGift,isGift,Was the offer accepted as a gift for someone other than the buyer.,,是否礼物,是否礼物,,,,,http://schema.org/isGift
property,http://cnschema.org/isLiveBroadcast,isLiveBroadcast,True is the broadcast is of a live event.,,是否直播,指明该广播是否为现场直播,,,,,http://schema.org/isLiveBroadcast
property,http://cnschema.org/isPartOf,isPartOf,Indicates a CreativeWork that this CreativeWork is (in some sense) part of.,,从属于,是它的一部分,,part of,https://www.wikidata.org/entity/P361,,http://schema.org/isPartOf
property,http://cnschema.org/isRelatedTo,isRelatedTo,"A pointer to another, somehow related product (or multiple products).",,相关,跟它相关,,,,,http://schema.org/isRelatedTo
property,http://cnschema.org/isSimilarTo,isSimilarTo,"A pointer to another, functionally similar product (or multiple products).",,相似,跟它相似,,,,,http://schema.org/isSimilarTo
property,http://cnschema.org/isVariantOf,isVariantOf,"A pointer to a base product from which this product is a variant. It is safe to infer that the variant inherits all product features from the base model, unless defined locally. This is not transitive.",,变形,是他的一种变形,,,,,http://schema.org/isVariantOf
property,http://cnschema.org/isbn,isbn,The ISBN of the book.,,ISBN码,书籍的国际标准书号(ISBN),,,,,http://schema.org/isbn
property,http://cnschema.org/isicV4,isicV4,"The International Standard of Industrial Classification of All Economic Activities (ISIC), Revision 4 code for a particular organization, business person, or place.",,国际标准行业分类,ISIC是所有经济活动的国际工业分类标准，而V4代码是为特定组织，商业人士或地点的修订,,,,,http://schema.org/isicV4
property,http://cnschema.org/isrcCode,isrcCode,The International Standard Recording Code for the recording.,,国际标准音像制品代码,国际标准音像制品代码,,International Standard Recording Code,https://www.wikidata.org/entity/P1243,,http://schema.org/isrcCode
property,http://cnschema.org/issn,issn,The International Standard Serial Number (ISSN) that identifies this periodical. You can repeat this property to (for example) identify different formats of this periodical.,,ISSN号,期刊的国际标准序列号,,ISSN,http://www.wikidata.org/entity/P236,https://en.wikipedia.org/wiki/Issn,http://schema.org/issn
property,http://cnschema.org/issueNumber,issueNumber,"Identifies the issue of publication; for example, ""iii"" or ""2"".",,期刊号,期刊标记符,,,,,http://schema.org/issueNumber
property,http://cnschema.org/issuedBy,issuedBy,The organization issuing the ticket or permit.,,许可的签发机构,许可的签发机构,,issued by,http://www.wikidata.org/entity/P2378,https://en.wikipedia.org/wiki/Issue_number,http://schema.org/issuedBy
property,http://cnschema.org/issuedThrough,issuedThrough,The service through with the permit was granted.,,被许可的服务,被许可的服务,,,,,http://schema.org/issuedThrough
property,http://cnschema.org/iswcCode,iswcCode,The International Standard Musical Work Code for the composition.,,国际标准音乐作品编码,国际标准音乐作品编码,国际标准音乐作品编号,ISWC,http://www.wikidata.org/entity/P1827,https://en.wikipedia.org/wiki/ISWC,http://schema.org/iswcCode
property,http://cnschema.org/item,item,An entity represented by an entry in a list or data feed (e.g. an 'artist' in a list of 'artists')’.,,条目,列表中的一项,,,,,http://schema.org/item
property,http://cnschema.org/itemCondition,itemCondition,"A predefined value from OfferItemCondition or a textual description of the condition of the product or service, or the products or services included in the offer.",,规格,预定义值,品相,,,,http://schema.org/itemCondition
property,http://cnschema.org/itemListElement,itemListElement,"For itemListElement values, you can use simple strings (e.g. ""Peter"", ""Paul"", ""Mary""), existing entities, or use ListItem. Text values are best if the elements in the list are plain strings. Existing entities are best for a simple, unordered list of existing things in your data. ListItem is used with ordered lists when you want to provide additional context about the element in that list or when the same item might be in different places in different lists. Note: The order of elements in your mark-up is not sufficient for indicating the order or elements. Use ListItem with a 'position' property in such cases.",,列表里的项目元素,列表里的项目元素，每个元素的值可以为字符串，实体等。,,,,,http://schema.org/itemListElement
property,http://cnschema.org/itemListOrder,itemListOrder,"Type of ordering (e.g. Ascending, Descending, Unordered).",,列表排列顺序,列表中元素的排列顺序（如升序，降序）,,,,,http://schema.org/itemListOrder
property,http://cnschema.org/itemOffered,itemOffered,The item being offered.,,销售物品,销售的物品,,,,,http://schema.org/itemOffered
property,http://cnschema.org/itemReviewed,itemReviewed,The item that is being reviewed/rated.,,评价物品,正在被评论或打分的物品,,,,,http://schema.org/itemReviewed
property,http://cnschema.org/itemShipped,itemShipped,Item(s) being shipped.,,运送物品,正在被运送的物品,,,,,http://schema.org/itemShipped
property,http://cnschema.org/jobBenefits,jobBenefits,Description of benefits associated with the job.,,职位福利,该职位具有的福利,,,,https://en.wikipedia.org/wiki/Job_benefit,http://schema.org/jobBenefits
property,http://cnschema.org/jobLocation,jobLocation,A (typically single) geographic location associated with the job position.,,工作地点,工作所在地的地址,,,,,http://schema.org/jobLocation
property,http://cnschema.org/jobTitle,jobTitle,"The job title of the person (for example, Financial Manager).",,工作头衔,一个人的工作头衔,职位,,,,http://schema.org/jobTitle
property,http://cnschema.org/keywords,keywords,Keywords or tags used to describe this content. Multiple entries in a keywords list are typically delimited by commas.,,关键词,文章中的关键词或标签,关键字,,,,http://schema.org/keywords
property,http://cnschema.org/knownVehicleDamages,knownVehicleDamages,"A textual description of known damages, both repaired and unrepaired.",,已知汽车故障,已知汽车故障的文本描述，包括可修复的和不可修复的,,,,,http://schema.org/knownVehicleDamages
property,http://cnschema.org/knows,knows,The most generic bi-directional social/work relation.,,认识,认识,双向的社交或工作关系,,,,http://schema.org/knows
property,http://cnschema.org/landlord,landlord,A sub property of participant. The owner of the real estate property.,,房东,房地产业主,,,,https://en.wikipedia.org/wiki/Landlord,http://schema.org/landlord
property,http://cnschema.org/language,language,A sub property of instrument. The language used on this action.,http://schema.org/inLanguage,语言,使用的语言,,language,https://www.wikidata.org/entity/P2439,https://en.wikipedia.org/wiki/Language,http://schema.org/language
property,http://cnschema.org/lastReviewed,lastReviewed,Date on which the content on this web page was last reviewed for accuracy and/or completeness.,,最近审查时间,上一次审查本网页内容的准确性和或完整性的日期。,最近审查日期,,,,http://schema.org/lastReviewed
property,http://cnschema.org/latitude,latitude,The latitude of a location. For example 37.42242 (WGS 84).,,纬度,一个位置的纬度,,,,https://en.wikipedia.org/wiki/Latitude,http://schema.org/latitude
property,http://cnschema.org/learningResourceType,learningResourceType,"The predominant type or kind characterizing the learning resource. For example, 'presentation', 'handout'.",,学习资料类型,表示学习资料类型或种类。包括演示，讲义等,,,,,http://schema.org/learningResourceType
property,http://cnschema.org/legalName,legalName,"The official name of the organization, e.g. the registered company name.",,官方名称,依法登记的名字，组织或机构的官方名称，比如 注册的企业名,,official name,http://www.wikidata.org/entity/P1448,https://en.wikipedia.org/wiki/Legal_name,http://schema.org/legalName
property,http://cnschema.org/leiCode,leiCode,An organization identifier that uniquely identifies a legal entity as defined in ISO 17442.,,全球法人机构识别编码,全球法人机构识别编码,,Legal Entity ID,https://www.wikidata.org/entity/P1278,,http://schema.org/leiCode
property,http://cnschema.org/lender,lender,A sub property of participant. The person that lends the object being borrowed.,,借出者,借出东西给别人的人,,,,https://en.wikipedia.org/wiki/Lender,http://schema.org/lender
property,http://cnschema.org/lesser,lesser,This ordering relation for qualitative values indicates that the subject is lesser than the object.,,小于,数学中的小于,,,,,http://schema.org/lesser
property,http://cnschema.org/lesserOrEqual,lesserOrEqual,This ordering relation for qualitative values indicates that the subject is lesser than or equal to the object.,,小于等于,数学中的小于等于,,,,,http://schema.org/lesserOrEqual
property,http://cnschema.org/license,license,"A license document that applies to this content, typically indicated by URL.",,许可证书,适用于此内容的许可证文件，通常由URL指示。,,license,http://www.wikidata.org/entity/P275,https://en.wikipedia.org/wiki/License,http://schema.org/license
property,http://cnschema.org/line,line,A line is a point-to-point path consisting of two or more points. A line is expressed as a series of two or more point objects separated by space.,,直线,由两点或多点组成的点对点路径,,,,https://en.wikipedia.org/wiki/Line_(geometry),http://schema.org/line
property,http://cnschema.org/liveBlogUpdate,liveBlogUpdate,An update to the LiveBlog.,,博客直播的一条更新,博客直播的一条更新,,,,,http://schema.org/liveBlogUpdate
property,http://cnschema.org/loanTerm,loanTerm,The duration of the loan or credit agreement.,,贷款期限,贷款或信贷协议的期限。,,,,,http://schema.org/loanTerm
property,http://cnschema.org/location,location,"The location of for example where the event is happening, an organization is located, or where an action takes place.",,地点,地址,,,,,http://schema.org/location
property,http://cnschema.org/locationCreated,locationCreated,"The location where the CreativeWork was created, which may not be the same as the location depicted in the CreativeWork.",,创建地点,作品中创建的地址,,,,,http://schema.org/locationCreated
property,http://cnschema.org/lodgingUnitDescription,lodgingUnitDescription,A full description of the lodging unit.,,旅馆房间描述,旅馆房间的一个完整描述,,,,,http://schema.org/lodgingUnitDescription
property,http://cnschema.org/lodgingUnitType,lodgingUnitType,"Textual description of the unit type (including suite vs. room, size of bed, etc.).",,旅馆房间房型,旅馆房间房型的描述,,,,,http://schema.org/lodgingUnitType
property,http://cnschema.org/logo,logo,An associated logo.,,商标,关联的商标,,logo image,http://www.wikidata.org/entity/P154,https://en.wikipedia.org/wiki/Logo,http://schema.org/logo
property,http://cnschema.org/longitude,longitude,The longitude of a location. For example -122.08585 (WGS 84).,,经度,位置的经度,,,,https://en.wikipedia.org/wiki/Longitude,http://schema.org/longitude
property,http://cnschema.org/loser,loser,A sub property of participant. The loser of the action.,,输家,一个行为中的失败者,失败者,,,,http://schema.org/loser
property,http://cnschema.org/lowPrice,lowPrice,The lowest price of all offers available.,,最低价格,所有价格中的最低价,,,,,http://schema.org/lowPrice
property,http://cnschema.org/lyricist,lyricist,The person who wrote the words.,,作词者,歌曲的词作者,词作者,lyrics by,http://www.wikidata.org/entity/P676,https://en.wikipedia.org/wiki/Lyricist,http://schema.org/lyricist
property,http://cnschema.org/lyrics,lyrics,The words in the song.,,歌词,歌曲的歌词,,,,https://en.wikipedia.org/wiki/Lyrics,http://schema.org/lyrics
property,http://cnschema.org/mainContentOfPage,mainContentOfPage,Indicates if this web page element is the main subject of the page.,,是否网页主题,指示此网页元素是否是该页面的主题。,,,,,http://schema.org/mainContentOfPage
property,http://cnschema.org/mainEntity,mainEntity,Indicates the primary entity described in some page or other CreativeWork.,,核心实体,网页或艺术品的核心实体,,,,,http://schema.org/mainEntity
property,http://cnschema.org/mainEntityOfPage,mainEntityOfPage,Indicates a page (or other CreativeWork) for which this thing is the main entity being described. See background notes for details.,,页面的核心实体,表示这个东西是描述的主要实体的页面,,,,,http://schema.org/mainEntityOfPage
property,http://cnschema.org/makesOffer,makesOffer,A pointer to products or services offered by the organization or person.,,提供的产品或服务,提供的产品或服务,,,,,http://schema.org/makesOffer
property,http://cnschema.org/manufacturer,manufacturer,The manufacturer of the product.,,制造商,产品的制造商,产品制造商,,,,http://schema.org/manufacturer
property,http://cnschema.org/map,map,A URL to a map of the place.,http://schema.org/hasMap,地图,地图上位置的URL地址,,,,,http://schema.org/map
property,http://cnschema.org/mapType,mapType,"Indicates the kind of Map, from the MapCategoryType Enumeration.",,地图类型,表示地图的种类,,,,,http://schema.org/mapType
property,http://cnschema.org/maps,maps,A URL to a map of the place.,http://schema.org/hasMap,地图,地图上位置的URL地址,,,,,http://schema.org/maps
property,http://cnschema.org/material,material,"A material that something is made from, e.g. leather, wool, cotton, paper.",,材质,物体使用的材料,,material used,https://www.wikidata.org/entity/P186,,http://schema.org/material
property,http://cnschema.org/maxPrice,maxPrice,The highest price if the price is a range.,,最高价格,最高价,,,,,http://schema.org/maxPrice
property,http://cnschema.org/maxValue,maxValue,The upper value of some characteristic or property.,,最大值,特征或属性的最大值,,,,,http://schema.org/maxValue
