category,@id,name,description,supersededBy,nameZh,descriptionZh,alternateName,wikidataName,wikidataUrl,wikipediaUrl,schemaorgUrl
property,http://cnschema.org/sportsEvent,sportsEvent,A sub property of location. The sports event where this action occurred.,,运动有关的活动,地点的子属性，表示体育赛事举行的地方,,,,https://en.wikipedia.org/wiki/Sports_event,http://schema.org/sportsEvent
property,http://cnschema.org/sportsTeam,sportsTeam,A sub property of participant. The sports team that participated on this action.,,参赛队伍,参与者的子属性，表示参与活动的队伍,,,,https://en.wikipedia.org/wiki/Sports_team,http://schema.org/sportsTeam
property,http://cnschema.org/spouse,spouse,The person's spouse.,,配偶,此人的妻子，或者丈夫,,spouse,http://www.wikidata.org/entity/P26,https://en.wikipedia.org/wiki/Spouse,http://schema.org/spouse
property,http://cnschema.org/starRating,starRating,"An official rating for a lodging business or food establishment, e.g. from national associations or standards bodies. Use the author property to indicate the rating organization, e.g. as an Organization with name such as (e.g. HOTREC, DEHOGA, WHR, or Hotelstars).",,星级评分,住宿业务或食品业的官方（例如 来自国家协会或标准机构）评级。使用author属性指示评级机构，例如，作为一个名称为(例如HOTREC、DEHOGA、WHR或Hotelstars)的机构。,,,,https://en.wikipedia.org/wiki/Star_rating,http://schema.org/starRating
property,http://cnschema.org/startDate,startDate,The start date and time of the item (in ISO 8601 date format).,,开始日期,某事的开始日期和时间（按照ＩＳＯ ８６０１日期标准）,,,,,http://schema.org/startDate
property,http://cnschema.org/startTime,startTime,"The startTime of something. For a reserved event or service (e.g. FoodEstablishmentReservation), the time that it is expected to start. For actions that span a period of time, when the action was performed. e.g. John wrote a book from January to December. Note that Event uses startDate/endDate instead of startTime/endTime, even when describing dates with times. This situation may be clarified in future revisions.",,开始时刻,某事的预期开始时间。对于跨越一段时间的动作。例如，约翰从１月到１２月写了一本书。注意：事件使用startDate / endDate而不是startTime / endTime，即使用时间描述日期。 今后的修订可能会澄清这种情况。,,start time,http://www.wikidata.org/entity/P580,,http://schema.org/startTime
property,http://cnschema.org/steeringPosition,steeringPosition,The position of the steering wheel or similar device (mostly for cars).,,方向盘位置,方向盘，或者其他类似设备（主要是汽车的设备）的位置。,,,,,http://schema.org/steeringPosition
property,http://cnschema.org/step,step,"A single step item (as HowToStep, text, document, video, etc.) or a HowToSection.",,相关操作步骤,操作包含的步骤,,,,,http://schema.org/step
property,http://cnschema.org/stepValue,stepValue,The stepValue attribute indicates the granularity that is expected (and required) of the value in a PropertyValueSpecification.,,步长,数值增长的原子单位。例如，出租车起步价后，每多一公里增加几块钱。,,,,,http://schema.org/stepValue
property,http://cnschema.org/steps,steps,"A single step item (as HowToStep, text, document, video, etc.) or a HowToSection (originally misnamed 'steps'; 'step' is preferred).",http://schema.org/step,相关操作步骤,操作包含的步骤,,,,,http://schema.org/steps
property,http://cnschema.org/storageRequirements,storageRequirements,Storage requirements (free space required).,,所需磁盘空间,需要的磁盘空间,,,,,http://schema.org/storageRequirements
property,http://cnschema.org/streetAddress,streetAddress,"The street address. For example, 1600 Amphitheatre Pkwy.",,街道地址,街道地址，例如，1600圆形剧场,,located at street address,http://www.wikidata.org/entity/P969,https://en.wikipedia.org/wiki/Street_address,http://schema.org/streetAddress
property,http://cnschema.org/subEvent,subEvent,"An Event that is part of this event. For example, a conference event includes many presentations, each of which is a subEvent of the conference.",,子活动,表示事件的一部分。 例如，会议事件包括许多演示文稿，每个演示文稿都是会议的子事件,,,,,http://schema.org/subEvent
property,http://cnschema.org/subEvents,subEvents,"Events that are a part of this event. For example, a conference event includes many presentations, each subEvents of the conference.",http://schema.org/subEvent,子活动,表示事件的一部分。 例如，会议事件包括许多演示文稿，每个演示文稿都是会议的子事件,,,,,http://schema.org/subEvents
property,http://cnschema.org/supply,supply,A sub-property of instrument. A supply consumed when performing instructions or a direction.,,相关物料,操作所需要的物料。,,,,,http://schema.org/supply
property,http://cnschema.org/subOrganization,subOrganization,"A relationship between two organizations where the first includes the second, e.g., as a subsidiary. See also: the more specific 'department' property.",,子机构,两个组织之间的关系。其中第二个组织，例如以子公司的名字，属于第一个组织。,,,,,http://schema.org/subOrganization
property,http://cnschema.org/subReservation,subReservation,The individual reservations included in the package. Typically a repeated property.,,子预定信息,此整体预定当中的个体预订事项，通常此属性是重复的。,,,,,http://schema.org/subReservation
property,http://cnschema.org/subtitleLanguage,subtitleLanguage,"Languages in which subtitles/captions are available, in IETF BCP 47 standard format.",,字幕语言,字幕语言，格式一般为IETF BCP 47标准,,,,,http://schema.org/subtitleLanguage
property,http://cnschema.org/successorOf,successorOf,"A pointer from a newer variant of a product to its previous, often discontinued predecessor.",,上一代型号,新一代的产品之前的产品，通常是已经停产的产品,,,,,http://schema.org/successorOf
property,http://cnschema.org/sugarContent,sugarContent,The number of grams of sugar.,,糖含量,糖的克数,,,,,http://schema.org/sugarContent
property,http://cnschema.org/suggestedAnswer,suggestedAnswer,"An answer (possibly one of several, possibly incorrect) to a Question, e.g. on a Question/Answer site.",,建议的答案,糖的克数,,,,,http://schema.org/suggestedAnswer
property,http://cnschema.org/suggestedGender,suggestedGender,The gender of the person or audience.,,建议的受众性别,受众的性别,,,,,http://schema.org/suggestedGender
property,http://cnschema.org/suggestedMaxAge,suggestedMaxAge,Maximal age recommended for viewing content.,,建议的受众最大年龄,推荐的内容受众的最大年龄,,,,,http://schema.org/suggestedMaxAge
property,http://cnschema.org/suggestedMinAge,suggestedMinAge,Minimal age recommended for viewing content.,,建议的受众最小年龄,推荐的内容受众的最小年龄,,,,,http://schema.org/suggestedMinAge
property,http://cnschema.org/suitableForDiet,suitableForDiet,"Indicates a dietary restriction or guideline for which this recipe or menu item is suitable, e.g. diabetic, halal etc.",,适用的饮食,表示该食谱或菜单的适用群体指南，例如 糖尿病，清真等,,,,,http://schema.org/suitableForDiet
property,http://cnschema.org/superEvent,superEvent,"An event that this event is a part of. For example, a collection of individual music performances might each have a music festival as their superEvent.",,上一级的活动,例如，个人音乐表演的集合可能每个都有一个音乐节作为他们的上一级活动。,,,,,http://schema.org/superEvent
property,http://cnschema.org/supply,supply,A sub-property of instrument. A supply consumed when performing instructions or a direction.,,相关物料,操作所需要的物料。,,,,,http://schema.org/supply
property,http://cnschema.org/supportingData,supportingData,Supporting data for a SoftwareApplication.,,软件应用所需的数据,例如杀毒软件所需要的病毒数据库,,,,,http://schema.org/supportingData
property,http://cnschema.org/surface,surface,"A material used as a surface in some artwork, e.g. Canvas, Paper, Wood, Board, etc.",http://schema.org/artworkSurface,作品材质,艺术品基质材料，例如帆布，纸，木头，木板,,,,,http://schema.org/surface
property,http://cnschema.org/target,target,Indicates a target EntryPoint for an Action.,,目标,表示行动的目标入口点,,,,,http://schema.org/target
property,http://cnschema.org/targetCollection,targetCollection,A sub property of object. The collection target of the action.,,行动要达到的目标,行动要达到的一系列目标,,,,,http://schema.org/targetCollection
property,http://cnschema.org/targetDescription,targetDescription,The description of a node in an established educational framework.,,目标知识点的描述,目标知识点的描述,,,,,http://schema.org/targetDescription
property,http://cnschema.org/targetName,targetName,The name of a node in an established educational framework.,,目标知识点的名称,目标知识点的名称,,,,,http://schema.org/targetName
property,http://cnschema.org/targetPlatform,targetPlatform,"Type of app development: phone, Metro style, desktop, XBox, etc.",,软件应用的目标硬件平台,应用程序的目标硬件平台，例如手机，台式机，XBox,,,,,http://schema.org/targetPlatform
property,http://cnschema.org/targetProduct,targetProduct,"Target Operating System / Product to which the code applies. If applies to several versions, just the product name can be used.",,软件应用的目标操作系统,软件可以适用的目标操作系统或者产品。如果有多个版本都可以适用，则只能使用产品名称,,,,,http://schema.org/targetProduct
property,http://cnschema.org/targetUrl,targetUrl,The URL of a node in an established educational framework.,,目标知识点的链接,指向目标知识点的链接,,,,,http://schema.org/targetUrl
property,http://cnschema.org/taxID,taxID,"The Tax / Fiscal ID of the organization or person, e.g. the TIN in the US or the CIF/NIF in Spain.",,纳税识别号码,组织或个人的税/财务编号，例如 美国的TIN或西班牙的CIF / NIF,,,,https://en.wikipedia.org/wiki/Tax_ID,http://schema.org/taxID
property,http://cnschema.org/telephone,telephone,The telephone number.,,电话号码,电话号码,,phone number,http://www.wikidata.org/entity/P1329,https://en.wikipedia.org/wiki/Telephone,http://schema.org/telephone
property,http://cnschema.org/toRecipient,toRecipient,A sub property of recipient. The recipient who was directly sent the message.,,收件人,消息的主要收件人,,,,,http://schema.org/toRecipient
property,http://cnschema.org/tool,tool,A sub property of instrument. An object used (but not consumed) when performing instructions or a direction.,,相关工具,操作所需要的工具,,,,,http://schema.org/tool
property,http://cnschema.org/temporal,temporal,"The range of temporal applicability of a dataset, e.g. for a 2011 census dataset, the year 2011 (in ISO 8601 time interval format).",http://schema.org/temporalCoverage,数据集的时间跨度,数据集的时间适用范围，例如 2011年人口普查数据集，2011年（按ISO 8601时间间隔格式）,,,,https://en.wikipedia.org/wiki/Temporal,http://schema.org/temporal
property,http://cnschema.org/temporalCoverage,temporalCoverage,"The temporalCoverage of a CreativeWork indicates the period that the content applies to, i.e. that it describes, either as a DateTime or as a textual string indicating a time period in ISO 8601 time interval format. In the case of a Dataset it will typically indicate the relevant time period in a precise notation (e.g. for a 2011 census dataset, the year 2011 would be written ""2011/2012""). Other forms of content e.g. ScholarlyArticle, Book, TVSeries or TVEpisode may indicate their temporalCoverage in broader terms - textually or via well-known URL. Written works such as books may sometimes have precise temporal coverage too, e.g. a work set in 1939 - 1945 can be indicated in ISO 8601 interval format format via ""1939/1945"".",,数据集的时间跨度,作品所描写或有效于的时间段，格式是根据ISO8601的DateTime或者string。数据作品通常会有精确的相关时间（例：2011年国家普查会符合ISO8601被写为“2011/2012”）。其它作品（学术文章，电影，电视剧等）会更广泛地在作品内或利用知名的链接来标明时间段。,,date depicted,http://www.wikidata.org/entity/P2913,,http://schema.org/temporalCoverage
property,http://cnschema.org/text,text,The textual content of this CreativeWork.,,文本,作品的文字内容,,,,,http://schema.org/text
property,http://cnschema.org/touristType,touristType,"Attraction suitable for type(s) of tourist. eg. Children, visitors from a particular country, etc.",,适宜的访客类型,景点适宜的访客类型,,,,,http://schema.org/touristType
property,http://cnschema.org/thumbnail,thumbnail,Thumbnail image for an image or video.,,缩略图,图片或者文本的缩略图片,,,,https://en.wikipedia.org/wiki/Thumbnail,http://schema.org/thumbnail
property,http://cnschema.org/thumbnailUrl,thumbnailUrl,A thumbnail image relevant to the Thing.,,缩略图链接,一个事物可以带图，也可以有缩略图。,,,,,http://schema.org/thumbnailUrl
property,http://cnschema.org/tickerSymbol,tickerSymbol,"The exchange traded instrument associated with a Corporation object. The tickerSymbol is expressed as an exchange and an instrument name separated by a space character. For the exchange component of the tickerSymbol attribute, we reccommend using the controlled vocaulary of Market Identifier Codes (MIC) specified in ISO15022.",,股票代号,股票代码符号表示为交换和以空格字符分隔的票据名称。,,ticker symbol,http://www.wikidata.org/entity/P249,https://en.wikipedia.org/wiki/Ticker_symbol,http://schema.org/tickerSymbol
property,http://cnschema.org/ticketNumber,ticketNumber,The unique identifier for the ticket.,,票据编号,可以确定票据的唯一标识,,,,,http://schema.org/ticketNumber
property,http://cnschema.org/ticketToken,ticketToken,"Reference to an asset (e.g., Barcode, QR code image or PDF) usable for entrance.",,票据的二维码或条形码,票据的二维码等标识符。,,,,,http://schema.org/ticketToken
property,http://cnschema.org/ticketedSeat,ticketedSeat,The seat associated with the ticket.,,票据对应的座位,与票据对应的座位,,,,,http://schema.org/ticketedSeat
property,http://cnschema.org/timeRequired,timeRequired,"Approximate or typical time it takes to work with or through this learning resource for the typical intended target audience, e.g. 'P30M', 'P1H25M'.",,所需时间,受众阅览或使用此学习资源的通常所需时间。,,,,,http://schema.org/timeRequired
property,http://cnschema.org/title,title,The title of the job.,,头衔,工作职位名称,,,,,http://schema.org/title
property,http://cnschema.org/toLocation,toLocation,A sub property of location. The final location of the object or the agent after the action.,,到什么地方,地方的子属性。表示目的地。,,,,,http://schema.org/toLocation
property,http://cnschema.org/toRecipient,toRecipient,A sub property of recipient. The recipient who was directly sent the message.,,收件人,消息的直接收件人,,,,,http://schema.org/toRecipient
property,http://cnschema.org/tool,tool,A sub property of instrument. An object used (but not consumed) when performing instructions or a direction.,,相关工具,操作所需要的工具,,,,,http://schema.org/tool
property,http://cnschema.org/totalPaymentDue,totalPaymentDue,The total amount due.,,应付款总额,应该支付的总金额,,,,,http://schema.org/totalPaymentDue
property,http://cnschema.org/totalPrice,totalPrice,"The total price for the reservation or ticket, including applicable taxes, shipping, etc.",,总价,预订服务或者购票的总价格，包含税，运费等,,,,,http://schema.org/totalPrice
property,http://cnschema.org/totalTime,totalTime,"The total time it takes to prepare and cook the recipe, in ISO 8601 duration format.",,总时间,准备和烹饪食物需要的总时间。时间格式ISO 8601,,,,,http://schema.org/totalTime
property,http://cnschema.org/touristType,touristType,"Attraction suitable for type(s) of tourist. eg. Children, visitors from a particular country, etc.",,适宜的游客类型,景点适宜的游客类型,,,,,http://schema.org/touristType
property,http://cnschema.org/track,track,"A music recording (track)—usually a single song. If an ItemList is given, the list should contain items of type MusicRecording.",,音轨,一段音乐记录，通常包含一首歌。如果给定了条目列表，那条目列表当中应包括MusicRecording。,,,,,http://schema.org/track
property,http://cnschema.org/trackingNumber,trackingNumber,Shipper tracking number.,,运单号,运单跟踪号码,,,,https://en.wikipedia.org/wiki/Tracking_number,http://schema.org/trackingNumber
property,http://cnschema.org/trackingUrl,trackingUrl,Tracking url for the parcel delivery.,,物流状态跟踪链接,跟踪包裹递送状态的网址,,,,,http://schema.org/trackingUrl
property,http://cnschema.org/tracks,tracks,A music recording (track)—usually a single song.,http://schema.org/track,音轨,音乐记录的集合；一段音乐记录，通常是一首歌,,,,,http://schema.org/tracks
property,http://cnschema.org/trailer,trailer,"The trailer of a movie or tv/radio series, season, episode, etc.",,预告片,例如电影，电视剧等的预告片,,,,,http://schema.org/trailer
property,http://cnschema.org/trainName,trainName,The name of the train (e.g. The Orient Express).,,火车名称,例如东方快车,,,,,http://schema.org/trainName
property,http://cnschema.org/trainNumber,trainNumber,The unique identifier for the train.,,火车编号,火车的唯一的ID,,,,,http://schema.org/trainNumber
property,http://cnschema.org/transFatContent,transFatContent,The number of grams of trans fat.,,反式脂肪含量,反式脂肪酸克数,,,,,http://schema.org/transFatContent
property,http://cnschema.org/transcript,transcript,"If this MediaObject is an AudioObject or VideoObject, the transcript of that object.",,文字记录,描述视频或者音频对象的文本,,,,,http://schema.org/transcript
property,http://cnschema.org/translator,translator,"Organization or person who adapts a creative work to different languages, regional differences and technical requirements of a target market, or that translates during some event.",,翻译者,将作品翻译成其他语言的组织或者个人,,translator,http://www.wikidata.org/entity/P655,,http://schema.org/translator
property,http://cnschema.org/typeOfBed,typeOfBed,"The type of bed to which the BedDetail refers, i.e. the type of bed available in the quantity indicated by quantity.",,床位类型,在某种场合（例：酒店）订床时床的类型（例：单人床）。,,,,,http://schema.org/typeOfBed
property,http://cnschema.org/typeOfGood,typeOfGood,The product that this structured value is referring to.,,货物类型,此货物的类型。,,,,,http://schema.org/typeOfGood
property,http://cnschema.org/typicalAgeRange,typicalAgeRange,"The typical expected age range, e.g. '7-9', '11-'.",,适应年龄段,通常年龄范围，例如'7-9'，'11 - ',,,,,http://schema.org/typicalAgeRange
property,http://cnschema.org/underName,underName,The person or organization the reservation or ticket is for.,,持票人,例如：机票的持有者，为谁预订的服务,,,,,http://schema.org/underName
property,http://cnschema.org/unitCode,unitCode,The unit of measurement given using the UN/CEFACT Common Code (3 characters) or a URL. Other codes than the UN/CEFACT Common Code may be used with a prefix followed by a colon.,,单位代码,使用UN / CEFACT通用代码（3个字符）给出的测量单位或URL。 与UN / CEFACT通用代码相比，其他代码可能使用前缀后跟冒号。,,,,,http://schema.org/unitCode
property,http://cnschema.org/unitText,unitText,A string or text indicating the unit of measurement. Useful if you cannot provide a standard unit code for unitCode.,,单位文字,指示测量单位的字符串或文本。 如果您不能为unitCode提供标准单位代码，则很有用,,,,,http://schema.org/unitText
property,http://cnschema.org/unsaturatedFatContent,unsaturatedFatContent,The number of grams of unsaturated fat.,,不饱和脂肪含量,不饱和脂肪酸的克数,,,,,http://schema.org/unsaturatedFatContent
property,http://cnschema.org/uploadDate,uploadDate,Date when this media object was uploaded to this site.,,上传日期,此媒体上传到此网站的日期,,,,,http://schema.org/uploadDate
property,http://cnschema.org/upvoteCount,upvoteCount,"The number of upvotes this question, answer or comment has received from the community.",,支持总数,从社区中收到支持这个问题，或者答案或者评论的数量,,,,,http://schema.org/upvoteCount
property,http://cnschema.org/url,url,URL of the item.,,链接,链接,,reference URL,http://www.wikidata.org/entity/P854,https://en.wikipedia.org/wiki/URL,http://schema.org/url
property,http://cnschema.org/urlTemplate,urlTemplate,An url template (RFC6570) that will be used to construct the target of the execution of the action.,,链接模版,一个URL的模版，可以利用变化参数形成完整的URL。,,formatter URL,http://www.wikidata.org/entity/P1630,https://en.wikipedia.org/wiki/URL_Template,http://schema.org/urlTemplate
property,http://cnschema.org/userInteractionCount,userInteractionCount,The number of interactions for the CreativeWork using the WebSite or SoftwareApplication.,,用户交互数,通过网站或者应用程序与某个作品的交互数量,,,,,http://schema.org/userInteractionCount
property,http://cnschema.org/validFor,validFor,The time validity of the permit.,,有效时间,有效时间段,,,,,http://schema.org/validFor
property,http://cnschema.org/validFrom,validFrom,The date when the item becomes valid.,,生效日期,有效开始日期,,,,,http://schema.org/validFrom
property,http://cnschema.org/validIn,validIn,The geographic area where the permit is valid.,,有效地区,有效的地理区域,,applies to territorial jurisdiction,http://www.wikidata.org/entity/P1001,,http://schema.org/validIn
property,http://cnschema.org/validThrough,validThrough,"The date after when the item is not valid. For example the end of an offer, salary period, or a period of opening hours.",,有效截止日期,有效截止日期,,,,,http://schema.org/validThrough
property,http://cnschema.org/validUntil,validUntil,The date when the item is no longer valid.,,失效日期,项目不再有效的日期,,,,,http://schema.org/validUntil
property,http://cnschema.org/value,value,"The value of the quantitative value or property value node. For QuantitativeValue and MonetaryAmount, the recommended type for values is 'Number'. For PropertyValue, it can be 'Text;', 'Number', 'Boolean', or 'StructuredValue'.",,值,定量值或属性值节点的值。 对于定量值和货币金额，值的推荐类型是“数字”。 对于属性值，它可以是“Text”，“Number”，“Boolean”或“StructuredValue”。,,numeric value,http://www.wikidata.org/entity/P1181,,http://schema.org/value
property,http://cnschema.org/valueAddedTaxIncluded,valueAddedTaxIncluded,Specifies whether the applicable value-added tax (VAT) is included in the price specification or not.,,是否含税,指定价格规格中是否包含适用的增值税（VAT）,,,,,http://schema.org/valueAddedTaxIncluded
property,http://cnschema.org/valueMaxLength,valueMaxLength,Specifies the allowed range for number of characters in a literal value.,,值的最大长度,此数值允许的最长字符数,,,,,http://schema.org/valueMaxLength
property,http://cnschema.org/valueMinLength,valueMinLength,Specifies the minimum allowed range for number of characters in a literal value.,,值的最小长度,此数值允许的最短字符数,,,,,http://schema.org/valueMinLength
property,http://cnschema.org/valueName,valueName,Indicates the name of the PropertyValueSpecification to be used in URL templates and form encoding in a manner analogous to HTML's input@name.,,值的名称,指明在URL模板中使用的“属性值详情”的名称和编码，格式类似于HTML的input@name,,,,,http://schema.org/valueName
property,http://cnschema.org/valuePattern,valuePattern,Specifies a regular expression for testing literal values according to the HTML spec.,,值的正则表达式验证模版,指定根据HTML规范测试文字值的正则表达式,,,,,http://schema.org/valuePattern
property,http://cnschema.org/valueReference,valueReference,"A pointer to a secondary value that provides additional information on the original value, e.g. a reference temperature.",,参考值,指向提供关于原始值的附加信息，例如： 参考温度。,,,,,http://schema.org/valueReference
property,http://cnschema.org/valueRequired,valueRequired,Whether the property must be filled in to complete the action. Default is false.,,值是否必须,该属性是否为必填。默认值为false,,,,,http://schema.org/valueRequired
property,http://cnschema.org/vatID,vatID,The Value-added Tax ID of the organization or person.,,欧盟税号,组织或个人的增值税编号,,,,https://en.wikipedia.org/wiki/VAT_identification_number,http://schema.org/vatID
