category,@id,name,description,supersededBy,nameZh,descriptionZh,alternateName,wikidataName,wikidataUrl,wikipediaUrl,schemaorgUrl
type,http://cnschema.org/EventReservation,EventReservation,"A reservation for an event like a concert, sporting event, or lecture. Note: This type is for information about actual reservations, e.g. in confirmation emails or HTML pages with individual confirmations of reservations. For offers of tickets, use Offer.",,预定信息：活动,一个活动（如举办音乐会、体育赛事或演讲）的预定信息。 注意：此类型用于提供有关实际预订的信息，例如： 在确认电子邮件或HTML页面中，用户确认预订的信息。 如果需要票的出价，使用Offer。,,,,,http://schema.org/EventReservation
type,http://cnschema.org/EventStatusType,EventStatusType,EventStatusType is an enumeration type whose instances represent several states that an Event may be in.,,活动当前状态类型,活动当前状态类型是一个可枚举类型，包括活动可能处于的状态的多个值。,,,,,http://schema.org/EventStatusType
type,http://cnschema.org/EventVenue,EventVenue,An event venue.,,活动场所,用于举办活动的场所,,event venue,https://www.wikidata.org/wiki/Q18674739,https://en.wikipedia.org/wiki/Event_venues,http://schema.org/EventVenue
type,http://cnschema.org/ExerciseAction,ExerciseAction,The act of participating in exertive activity for the purposes of improving health and fitness.,,动作：锻炼,参与锻炼活动的动作，为了改善健康或体型。,,,,,http://schema.org/ExerciseAction
type,http://cnschema.org/ExerciseGym,ExerciseGym,A gym.,,健身房,健身房,,,,https://en.wikipedia.org/wiki/Gym,http://schema.org/ExerciseGym
type,http://cnschema.org/ExhibitionEvent,ExhibitionEvent,"Event type: Exhibition event, e.g. at a museum, library, archive, tradeshow, ...",,活动：和展览有关的,和展览有关的活动，如：在博物馆、图书馆、档案馆、贸易展…,,,,,http://schema.org/ExhibitionEvent
type,http://cnschema.org/FastFoodRestaurant,FastFoodRestaurant,A fast-food restaurant.,,快餐店,快餐店,,fast food restaurant,https://www.wikidata.org/wiki/Q1751429,https://en.wikipedia.org/wiki/Fast_food_restaurant,http://schema.org/FastFoodRestaurant
type,http://cnschema.org/Festival,Festival,Event type: Festival.,,节日,一种活动类型，节日。,,festival,https://www.wikidata.org/wiki/Q132241,https://en.wikipedia.org/wiki/Festival,http://schema.org/Festival
type,http://cnschema.org/FilmAction,FilmAction,"The act of capturing sound and moving images on film, video, or digitally.",,动作：摄像,在电影、录像或数码上捕捉声音或影像的动作。,,,,,http://schema.org/FilmAction
type,http://cnschema.org/FinancialProduct,FinancialProduct,"A product provided to consumers and businesses by financial institutions such as banks, insurance companies, brokerage firms, consumer finance companies, and investment companies which comprise the financial services industry.",,金融产品,由金融机构提供给消费者和企业的产品，例如银行、保险公司、经纪公司、消费金融公司和构成金融服务业的投资公司。,,financial product,https://www.wikidata.org/wiki/Q15809678,,http://schema.org/FinancialProduct
type,http://cnschema.org/FinancialService,FinancialService,Financial services business.,,金融服务机构,金融服务机构,,financial services,https://www.wikidata.org/wiki/Q837171,https://en.wikipedia.org/wiki/Financial_services,http://schema.org/FinancialService
type,http://cnschema.org/FindAction,FindAction,"The act of finding an object. Related actions: SearchAction: FindAction is generally lead by a SearchAction, but not necessarily.",,动作：寻找,寻找某一对象的动作。相关动作：SearchAction: FindAction通常由SearchAction发起，但并不一定。,,,,,http://schema.org/FindAction
type,http://cnschema.org/FireStation,FireStation,A fire station. With firemen.,,消防站,消防站。包括消防员,,fire station,https://www.wikidata.org/wiki/Q1195942,https://en.wikipedia.org/wiki/Fire_station,http://schema.org/FireStation
type,http://cnschema.org/Flight,Flight,An airline flight.,,航班,航班,,,,,http://schema.org/Flight
type,http://cnschema.org/FlightReservation,FlightReservation,"A reservation for air travel. Note: This type is for information about actual reservations, e.g. in confirmation emails or HTML pages with individual confirmations of reservations. For offers of tickets, use Offer.",,预定信息：航班,有关飞行的预订信息。注意：此类是有关实际预定的信息，如在确认邮件或HTML页面上有用户确认或预定。如果需要票的出价，使用Offer。,,,,,http://schema.org/FlightReservation
type,http://cnschema.org/Float,Float,Data type: Floating number.,,浮点数,数据类型，浮点数。,,,,,http://schema.org/Float
type,http://cnschema.org/Florist,Florist,A florist.,,花店,花店,,floristry,https://www.wikidata.org/wiki/Q637125,https://en.wikipedia.org/wiki/Floristry,http://schema.org/Florist
type,http://cnschema.org/FollowAction,FollowAction,"The act of forming a personal connection with someone/something (object) unidirectionally/asymmetrically to get updates polled from. Related actions: BefriendAction: Unlike BefriendAction, FollowAction implies that the connection is not necessarily reciprocal. SubscribeAction: Unlike SubscribeAction, FollowAction implies that the follower acts as an active agent constantly/actively polling for updates. RegisterAction: Unlike RegisterAction, FollowAction implies that the agent is interested in continuing receiving updates from the object. JoinAction: Unlike JoinAction, FollowAction implies that the agent is interested in getting updates from the object. TrackAction: Unlike TrackAction, FollowAction refers to the polling of updates of all aspects of animate objects rather than the location of inanimate objects (e.g. you track a package, but you don't follow it).",,动作：在推特上关注某人,与单个/某物（对象）单向/非对称地形成连接以获取新动态的行为。 相关操作：BefriendAction：与BefriendAction不同，FollowAction不一定是相互的。 SubscribeAction：与SubscribeAction不同，FollowAction表示关注者是个主动者，不断主动获取新动态。 RegisterAction：与RegisterAction不同，FollowAction意味着关注者有兴趣持续接收对象的更新。 JoinAction：与JoinAction不同，FollowAction意味着关注者有兴趣获取对象的更新。 TrackAction：与TrackAction不同，FollowAction表示获取实时对象的所有领域的更新，而不是非实时对象的地点（如，你可以跟踪一个包，但不关注它）。,,,,,http://schema.org/FollowAction
type,http://cnschema.org/FoodEstablishment,FoodEstablishment,A food-related business.,,餐饮服务机构,餐饮服务业的公司或机构,,food establishment,https://www.wikidata.org/wiki/Q27038993,,http://schema.org/FoodEstablishment
type,http://cnschema.org/FoodEstablishmentReservation,FoodEstablishmentReservation,"A reservation to dine at a food-related business.Note: This type is for information about actual reservations, e.g. in confirmation emails or HTML pages with individual confirmations of reservations.",,预定信息：餐饮,与餐饮相关的预订信息。注意：此类型用于提供有关实际预订的信息，例如： 在确认电子邮件或HTML页面中，单独确认预订信息。,,,,,http://schema.org/FoodEstablishmentReservation
type,http://cnschema.org/FoodEvent,FoodEvent,Event type: Food event.,,活动：和食物有关的,活动类型，食品活动,,,,,http://schema.org/FoodEvent
type,http://cnschema.org/FoodService,FoodService,"A food service, like breakfast, lunch, or dinner.",,提供早中晚饭的服务,提供早中晚饭的服务,,,,,http://schema.org/FoodService
type,http://cnschema.org/FurnitureStore,FurnitureStore,A furniture store.,,家具店,家具店,,,,,http://schema.org/FurnitureStore
type,http://cnschema.org/Game,Game,"The Game type represents things which are games. These are typically rule-governed recreational activities, e.g. role-playing games in which players assume the role of characters in a fictional setting.",,游戏,表示是游戏的事物。通常是有着固定规则的娱乐活动，例如角色扮演游戏，玩家在虚构设定中扮演角色。,,game,https://www.wikidata.org/wiki/Q11410,https://en.wikipedia.org/wiki/Game,http://schema.org/Game
type,http://cnschema.org/GamePlayMode,GamePlayMode,"Indicates whether this game is multi-player, co-op or single-player.",,游戏玩家模式,表明此游戏是多人游戏、合作游戏还是单人游戏。,,,,,http://schema.org/GamePlayMode
type,http://cnschema.org/GameServer,GameServer,Server that provides game interaction in a multiplayer game.,,游戏服务器,在多人游戏中提供游戏交互的服务器。,,game server,https://www.wikidata.org/wiki/Q1315933,https://en.wikipedia.org/wiki/Game_server,http://schema.org/GameServer
type,http://cnschema.org/GameServerStatus,GameServerStatus,Status of a game server.,,游戏服务器状态,游戏服务器的状态,,,,,http://schema.org/GameServerStatus
type,http://cnschema.org/GardenStore,GardenStore,A garden store.,,园艺店,园艺店,,,,,http://schema.org/GardenStore
type,http://cnschema.org/GasStation,GasStation,A gas station.,,加油站,加油站，指为汽车和其它机动车辆服务的、零售汽油和机油的补充站，一般为添加燃料油、润滑油等。,,gas station,https://www.wikidata.org/wiki/Q205495,https://en.wikipedia.org/wiki/Filling_station,http://schema.org/GasStation
type,http://cnschema.org/GatedResidenceCommunity,GatedResidenceCommunity,Residence type: Gated community.,,有门禁的住宅小区,住宅类型：有门禁的社区。,,gated community,https://www.wikidata.org/wiki/Q75848,https://en.wikipedia.org/wiki/Gated_community,http://schema.org/GatedResidenceCommunity
type,http://cnschema.org/GenderType,GenderType,An enumeration of genders.,,性别,性别,,sex or gender,https://www.wikidata.org/wiki/Property:P21,https://en.wikipedia.org/wiki/Gender,http://schema.org/GenderType
type,http://cnschema.org/GeneralContractor,GeneralContractor,A general contractor.,,总承包商,总承包商负责施工现场的日常监督、供应商和行业的管理以及在建筑项目过程中向关联方传达信息。,,general contractor,https://www.wikidata.org/wiki/Q289612,https://en.wikipedia.org/wiki/General_contractor,http://schema.org/GeneralContractor
type,http://cnschema.org/GeoCircle,GeoCircle,"A GeoCircle is a GeoShape representing a circular geographic area. As it is a GeoShape it provides the simple textual property 'circle', but also allows the combination of postalCode alongside geoRadius. The center of the circle can be indicated via the 'geoMidpoint' property, or more approximately using 'address', 'postalCode'.",,环形的地理区域,环形地理区域是一个GeoShape，表示环形的地理区域。由于它是一个GeoShape，它有一个简单的文本属性'circle'，但也允许组合postalCode与geoRadius。环形中心可以通过属性'geoMidpoint'指定，或者更多地使用'address'，'postalCode'指定。,,,,,http://schema.org/GeoCircle
type,http://cnschema.org/GeoCoordinates,GeoCoordinates,The geographic coordinates of a place or event.,,经纬度,一个地点或事件的经纬坐标,,,,,http://schema.org/GeoCoordinates
type,http://cnschema.org/GeoShape,GeoShape,The geographic shape of a place. A GeoShape can be described using several properties whose values are based on latitude/longitude pairs. Either whitespace or commas can be used to separate latitude and longitude; whitespace should be used when writing a list of several such points.,,地理区域形状,一个地方的地理形状,,,,,http://schema.org/GeoShape
type,http://cnschema.org/GiveAction,GiveAction,"The act of transferring ownership of an object to a destination. Reciprocal of TakeAction. Related actions: TakeAction: Reciprocal of GiveAction. SendAction: Unlike SendAction, GiveAction implies that ownership is being transferred (e.g. I may send my laptop to you, but that doesn't mean I'm giving it to you).",,动作：给予,将对象的所有权转移给目标的行为。相关动作：TakeAction：与GiveAction相对。SendAction：和SendAction不同，GiveAction表明所有权被转移（如：我可能把我的手提电脑借给你，但是这不意味着我把它给你了。）,,,,,http://schema.org/GiveAction
type,http://cnschema.org/GolfCourse,GolfCourse,A golf course.,,高尔夫球场,高尔夫球场，进行高尔夫球运动时所需的场地。,,golf course,https://www.wikidata.org/wiki/Q1048525,https://en.wikipedia.org/wiki/Golf_course,http://schema.org/GolfCourse
type,http://cnschema.org/GovernmentBuilding,GovernmentBuilding,A government building.,,政府建筑,政府建筑,,government building,https://www.wikidata.org/wiki/Q16831714,,http://schema.org/GovernmentBuilding
type,http://cnschema.org/GovernmentOffice,GovernmentOffice,"A government office—for example, an IRS or DMV office.",,政府办公室,政府办公室，如IRS或DMV办公室,,government agency,https://www.wikidata.org/wiki/Q327333,,http://schema.org/GovernmentOffice
type,http://cnschema.org/GovernmentOrganization,GovernmentOrganization,A governmental organization or agency.,,政府机构,政府组织或机构,,government organization,https://www.wikidata.org/wiki/Q2659904,https://en.wikipedia.org/wiki/Government_organization,http://schema.org/GovernmentOrganization
type,http://cnschema.org/GovernmentPermit,GovernmentPermit,A permit issued by a government agency.,,政府颁发的许可证,由政府机构颁发的许可证,,,,,http://schema.org/GovernmentPermit
type,http://cnschema.org/GovernmentService,GovernmentService,"A service provided by a government organization, e.g. food stamps, veterans benefits, etc.",,政府服务,由政府组织提供的服务，如食品救济券、退伍军人福利,行政服务,public service,https://www.wikidata.org/wiki/Q161837,https://en.wikipedia.org/wiki/Public_service,http://schema.org/GovernmentService
type,http://cnschema.org/GroceryStore,GroceryStore,A grocery store.,,杂货店,杂货店是指主要销售食品和其他家居用品的零售店。,,grocery store,https://www.wikidata.org/wiki/Q13584407,https://en.wikipedia.org/wiki/Grocery_store,http://schema.org/GroceryStore
type,http://cnschema.org/HowTo,HowTo,Instructions that explain how to achieve a result by performing a sequence of steps.,,操作流程说明,一组操作流程的说明,,,,https://en.wikipedia.org/wiki/How-to,http://schema.org/HowTo
type,http://cnschema.org/HowToDirection,HowToDirection,A direction indicating a single action to do in the instructions for how to achieve a result.,,步骤的操作说明,操作中的一个步骤的说明,,,,,http://schema.org/HowToDirection
type,http://cnschema.org/HowToItem,HowToItem,An item used as either a tool or supply when performing the instructions for how to to achieve a result.,,操作相关物品,操作中使用的物料或工具,,,,,http://schema.org/HowToItem
type,http://cnschema.org/HowToSection,HowToSection,A sub-grouping of steps in the instructions for how to achieve a result (e.g. steps for making a pie crust within a pie recipe).,,操作步骤组合,一组操作步骤,,,,,http://schema.org/HowToSection
type,http://cnschema.org/HowToStep,HowToStep,A step in the instructions for how to achieve a result. It is an ordered list with HowToDirection and/or HowToTip items.,,操作步骤,一个操作步骤,,,,,http://schema.org/HowToStep
type,http://cnschema.org/HowToSupply,HowToSupply,A supply consumed when performing the instructions for how to achieve a result.,,操作相关物料,操作中可能使用物料,,,,,http://schema.org/HowToSupply
type,http://cnschema.org/HowToTip,HowToTip,"An explanation in the instructions for how to achieve a result. It provides supplementary information about a technique, supply, author's preference, etc. It can explain what could be done, or what should not be done, but doesn't specify what should be done (see HowToDirection).",,步骤的注意事项,操作步骤的小建议与解释,,,,,http://schema.org/HowToTip
type,http://cnschema.org/HowToTool,HowToTool,A tool used (but not consumed) when performing instructions for how to achieve a result.,,操作相关工具,操作中可能使用工具,,,,,http://schema.org/HowToTool
type,http://cnschema.org/HVACBusiness,HVACBusiness,"A business that provide Heating, Ventilation and Air Conditioning services.",,暖通空调服务机构,提供供暖、通风与空调服务的机构。,,,,,http://schema.org/HVACBusiness
type,http://cnschema.org/HairSalon,HairSalon,A hair salon.,,美发店,美发店，有专业人士修剪头发的固定工作室。,发廊,hair salon,https://www.wikidata.org/wiki/Q27038996,https://en.wikipedia.org/wiki/Hair_salon,http://schema.org/HairSalon
type,http://cnschema.org/HardwareStore,HardwareStore,A hardware store.,,五金店,五金店，专卖以下工具：锯子、钻子、螺丝、改锥、水龙头、锁、管子、打气桶、电线等一类的东西。,,hardware store,https://www.wikidata.org/wiki/Q811530,https://en.wikipedia.org/wiki/Hardware_store,http://schema.org/HardwareStore
type,http://cnschema.org/HealthAndBeautyBusiness,HealthAndBeautyBusiness,Health and beauty.,,健康与美容服务机构,提供健康与美容服务的机构。,,,,,http://schema.org/HealthAndBeautyBusiness
type,http://cnschema.org/HealthClub,HealthClub,A health club.,,健身房,健身房，指一个容纳运动器材以进行体育锻炼的地方。,,health club,https://www.wikidata.org/wiki/Q1065656,https://en.wikipedia.org/wiki/Health_club,http://schema.org/HealthClub
type,http://cnschema.org/HighSchool,HighSchool,A high school.,,高中,高中，是高级中学的简称。,高级中学,high school,https://www.wikidata.org/wiki/Q9826,https://en.wikipedia.org/wiki/High_School,http://schema.org/HighSchool
type,http://cnschema.org/HinduTemple,HinduTemple,A Hindu temple.,,印度教寺庙,印度教寺庙。,,Hindu temple,https://www.wikidata.org/wiki/Q842402,,http://schema.org/HinduTemple
type,http://cnschema.org/HobbyShop,HobbyShop,A store that sells materials useful or necessary for various hobbies.,,业余爱好商店,业余爱好商店，为业余爱好者出售休闲用品。,,Hobby store,https://www.wikidata.org/wiki/Q5874968,https://en.wikipedia.org/wiki/Hobby_shop,http://schema.org/HobbyShop
type,http://cnschema.org/HomeAndConstructionBusiness,HomeAndConstructionBusiness,A construction business. A HomeAndConstructionBusiness is a LocalBusiness that provides services around homes and buildings. As a LocalBusiness it can be described as a provider of one or more Service(s).,,家装服务机构,家装服务机构。HomeAndConstructionBusiness是一个LocalBusiness，提供有关家居和建筑的服务。作为一个LocalBusiness，可以被描述成一个或多个服务的提供者。,,,,,http://schema.org/HomeAndConstructionBusiness
type,http://cnschema.org/HomeGoodsStore,HomeGoodsStore,A home goods store.,,家居用品店,家居用品店，贩卖家居用品，包括家具、床上用品、厨卫用具、室内配饰及日常生活需要的商品。,,,,,http://schema.org/HomeGoodsStore
type,http://cnschema.org/Hospital,Hospital,A hospital.,,医院,医院，指以向人提供医疗护理服务为主要目的医疗机构。,,hospital,https://www.wikidata.org/wiki/Q16917,https://en.wikipedia.org/wiki/Hospital,http://schema.org/Hospital
type,http://cnschema.org/Hostel,Hostel,"A hostel - cheap accommodation, often in shared dormitories. See also the dedicated document on the use of schema.org for marking up hotels and other forms of accommodations.",,招待所,低预算的社交型住宿，客人可以在宿舍租一张床，通常是双层床，然后与其他客人共用浴室、休息室或者厨房。例如招待所，青年旅社等。,,hostel,https://www.wikidata.org/wiki/Q654772,https://en.wikipedia.org/wiki/Hostel,http://schema.org/Hostel
type,http://cnschema.org/Hotel,Hotel,"A hotel is an establishment that provides lodging paid on a short-term basis (Source: Wikipedia, the free encyclopedia, see http://en.wikipedia.org/wiki/Hotel). See also the dedicated document on the use of schema.org for marking up hotels and other forms of accommodations.",,旅馆,旅馆是一个提供短期住宿的机构（来源wikipedia，http://zh.wikipedia.org/wiki/Hotel）。,酒店,hotel,https://www.wikidata.org/wiki/Q27686,https://en.wikipedia.org/wiki/Hotel,http://schema.org/Hotel
type,http://cnschema.org/HotelRoom,HotelRoom,A hotel room is a single room in a hotel. See also the dedicated document on the use of schema.org for marking up hotels and other forms of accommodations.,,旅馆房间,旅馆房间是旅馆里的单个房间。,,,,,http://schema.org/HotelRoom
type,http://cnschema.org/House,House,"A house is a building or structure that has the ability to be occupied for habitation by humans or other creatures (Source: Wikipedia, the free encyclopedia, see http://en.wikipedia.org/wiki/House).",,住宅,住宅，是人所建筑以供居住的建筑物（来源：http://zh.wikipedia.org/wiki/House）。,"房屋,家宅",house,https://www.wikidata.org/wiki/Q3947,https://en.wikipedia.org/wiki/House,http://schema.org/House
type,http://cnschema.org/HousePainter,HousePainter,A house painting service.,,油漆工,住宅粉刷服务。,,house painter,https://www.wikidata.org/wiki/Q288728,https://en.wikipedia.org/wiki/House_painter_and_decorator,http://schema.org/HousePainter
type,http://cnschema.org/HowTo,HowTo,Instructions that explain how to achieve a result by performing a sequence of steps.,,操作流程说明,一组操作流程的说明,,,,https://en.wikipedia.org/wiki/How-to,http://schema.org/HowTo
type,http://cnschema.org/HowToDirection,HowToDirection,A direction indicating a single action to do in the instructions for how to achieve a result.,,步骤的操作说明,操作中的一个步骤的说明,,,,,http://schema.org/HowToDirection
type,http://cnschema.org/HowToItem,HowToItem,An item used as either a tool or supply when performing the instructions for how to to achieve a result.,,操作相关物品,操作中使用的物料或工具,,,,,http://schema.org/HowToItem
type,http://cnschema.org/HowToSection,HowToSection,A sub-grouping of steps in the instructions for how to achieve a result (e.g. steps for making a pie crust within a pie recipe).,,操作步骤组合,一组操作步骤,,,,,http://schema.org/HowToSection
type,http://cnschema.org/HowToStep,HowToStep,A step in the instructions for how to achieve a result. It is an ordered list with HowToDirection and/or HowToTip items.,,操作步骤,一个操作步骤,,,,,http://schema.org/HowToStep
type,http://cnschema.org/HowToSupply,HowToSupply,A supply consumed when performing the instructions for how to achieve a result.,,操作相关物料,操作中可能使用物料,,,,,http://schema.org/HowToSupply
type,http://cnschema.org/HowToTip,HowToTip,"An explanation in the instructions for how to achieve a result. It provides supplementary information about a technique, supply, author's preference, etc. It can explain what could be done, or what should not be done, but doesn't specify what should be done (see HowToDirection).",,步骤的注意事项,操作步骤的小建议与解释,,,,,http://schema.org/HowToTip
type,http://cnschema.org/HowToTool,HowToTool,A tool used (but not consumed) when performing instructions for how to achieve a result.,,操作相关工具,操作中可能使用工具,,,,,http://schema.org/HowToTool
type,http://cnschema.org/IceCreamShop,IceCreamShop,An ice cream shop.,,冰淇淋店,冰淇淋店，卖冰淇淋。,,ice cream parlor,https://www.wikidata.org/wiki/Q1311064,https://en.wikipedia.org/wiki/Ice_cream_parlor,http://schema.org/IceCreamShop
type,http://cnschema.org/IgnoreAction,IgnoreAction,The act of intentionally disregarding the object. An agent ignores an object.,,动作：忽略,有意忽略对象的动作。,,,,,http://schema.org/IgnoreAction
type,http://cnschema.org/ImageGallery,ImageGallery,Web page type: Image gallery page.,,图片列表页面,网页类型：图片列表页面。,,,,,http://schema.org/ImageGallery
type,http://cnschema.org/ImageObject,ImageObject,An image file.,,图片对象,图像文件。,,,,,http://schema.org/ImageObject
type,http://cnschema.org/IndividualProduct,IndividualProduct,"A single, identifiable product instance (e.g. a laptop with a particular serial number).",,单个产品,单个、可辨别的产品实例（如具有特定序列号的手提电脑）。,,,,,http://schema.org/IndividualProduct
type,http://cnschema.org/InformAction,InformAction,"The act of notifying someone of information pertinent to them, with no expectation of a response.",,动作：告知,告知某人有关信息的动作，不期待回答。,,,,,http://schema.org/InformAction
type,http://cnschema.org/InsertAction,InsertAction,The act of adding at a specific location in an ordered collection.,,动作：插入,在一个有序集合的特定位置添加对象的动作。,,,,,http://schema.org/InsertAction
type,http://cnschema.org/InstallAction,InstallAction,The act of installing an application.,,动作：安装,安装一个应用的动作。,,,,,http://schema.org/InstallAction
type,http://cnschema.org/InsuranceAgency,InsuranceAgency,An Insurance agency.,,保险服务机构,保险服务机构，提供保险服务。,,insurance agency,https://www.wikidata.org/wiki/Q27038992,,http://schema.org/InsuranceAgency
